ID,Start time,Completion time,Email,Name,Last modified time,How often do you visit Crafty Crab?,How would you rate your most recent experience? (1-5),What did you order during your visit?,Food quality & freshness,Flavor & seasoning,Portion size   ,Speed of service   ,Staff friendliness   ,Cleanliness,What did you enjoy MOST about your visit?,What could we improve?,Would you join a Crafty Crab loyalty/rewards program?,What type of rewards would you prefer?,"What would encourage you to visit more often?
",Any additional comments or suggestions?
1,4/8/26 16:08:18,4/8/26 16:13:10,anonymous,,,Monthly,5,Fried seafood baskets,Very Satisfied    ,Very Satisfied    ,Very Satisfied    ,Very Satisfied    ,Very Satisfied    ,Very Satisfied    ,"I really enjoyed the ambiance and food quality. The staff are always welcoming, and my overall experience is always pleasant.","Overall experience was great. If I could suggest one thing, it is to consistently maintain the excellent service.",Yes,Birthday rewards;Exclusive deals;,Rewards program;Special events;New menu items;,
2,4/8/26 16:17:53,4/8/26 16:20:15,anonymous,,,Yearly,3,Seafood boil,Very Satisfied    ,Satisfied,Very Satisfied    ,Neutral,Very Satisfied    ,Very Satisfied    ,"I very much enjoyed the food. The proportions were really good, the food was well seasoned, my server was very nice, and the all around atmosphere was great. ","The speed of service could use some improvement. While my server was great, I did feel like they started to forget us towards the end as well. ",Maybe,Birthday rewards;Points-based system;,Rewards program;Faster service;,
3,4/8/26 17:26:35,4/8/26 17:34:11,anonymous,,,Daily,5,Seafood boil,Very Satisfied    ,Very Satisfied    ,Satisfied,Satisfied,Satisfied,Very Satisfied    ,"I enjoyed the atmosphere, everyone from customer to staff was very respectful and kind. ",Maybe add some bundle items for families. Like an order that's able to feed 2-4 people instead of having to do just a regular meal order.,Yes,Free seafood item;Birthday rewards;,Rewards program;Special events;,Only suggestion is for everyone to keep up the good work!
4,4/8/26 22:37:29,4/8/26 22:41:56,anonymous,,,Monthly,4,Fried seafood baskets,Very Satisfied    ,Satisfied,Satisfied,Satisfied,Very Satisfied    ,Very Satisfied    ,The clean and comfortable seats,Add more deals and discounts,Yes,Discounts;Exclusive deals;,Rewards program;New menu items;,Add new menu items
5,4/9/26 12:18:35,4/9/26 12:20:23,anonymous,,,Seasonal,5,Fried seafood baskets,Very Unsatisfied   ,Very Unsatisfied   ,Very Unsatisfied   ,Very Unsatisfied   ,Very Unsatisfied   ,Very Unsatisfied   ,flavors and food options are amazing.,More appetizers options.,Maybe,Free seafood item;,Better pricingĀ;,
6,4/10/26 1:03:17,4/10/26 1:04:20,anonymous,,,Weekly,5,Seafood boil,Very Satisfied    ,Very Satisfied    ,Very Satisfied    ,Satisfied,Satisfied,Very Satisfied    ,The Drinks ,The wait time ,Yes,Discounts;Birthday rewards;Points-based system;Free seafood item;Exclusive deals;,Better pricingĀ;Rewards program;Faster service;New menu items;Special events;,N/A
